{
  "schemaVersion": 1,
  "id": "standalone:valorant",
  "status": "verified",
  "names": {
    "en": "VALORANT",
    "zh-CN": "无畏契约"
  },
  "platform": "standalone",
  "platformId": "valorant",
  "executables": [
    { "name": "VALORANT-Win64-Shipping.exe" }
  ],
  "evidence": [
    { "kind": "publisher", "source": "Riot Games Windows client" },
    { "kind": "manual_review", "source": "Game2PL verified game-process rule; VALORANT.exe and Riot Client are launchers and excluded" }
  ],
  "lastVerified": "2026-10-19"
}
