{
  "schemaVersion": 1,
  "id": "standalone:zenless-zone-zero",
  "status": "verified",
  "names": {
    "en": "Zenless Zone Zero",
    "zh-CN": "绝区零"
  },
  "platform": "standalone",
  "platformId": "zenless-zone-zero",
  "executables": [
    { "name": "ZenlessZoneZero.exe" }
  ],
  "evidence": [
    { "kind": "publisher", "source": "miHoYo/HoYoverse Windows client" },
    { "kind": "manual_review", "source": "Game2PL built-in main-process rule; HoYoPlay launcher excluded" }
  ],
  "lastVerified": "2026-10-19"
}
