{
  "schemaVersion": 1,
  "id": "steam:1151340",
  "status": "verified",
  "names": {
    "en": "Fallout 76"
  },
  "platform": "steam",
  "platformId": "1151340",
  "executables": [
    {
      "name": "Fallout76.exe"
    }
  ],
  "evidence": [
    {
      "kind": "official_store",
      "source": "https://store.steampowered.com/app/1151340/Fallout_76/"
    },
    {
      "kind": "publisher",
      "source": "https://help.bethesda.net/app/answers/detail/a_id/50679/ Bethesda identifies Fallout76.exe in the Steam game installation separately from Steam.exe."
    }
  ],
  "lastVerified": "2026-10-28"
}
