{
  "schemaVersion": 1,
  "id": "standalone:jx3-online",
  "status": "verified",
  "names": {
    "en": "JX3 Online",
    "zh-CN": "剑网3"
  },
  "platform": "standalone",
  "platformId": "jx3-online",
  "executables": [
    { "name": "JX3ClientX64.exe" }
  ],
  "evidence": [
    { "kind": "publisher", "source": "Seasun Games Windows client" },
    { "kind": "manual_review", "source": "Game2PL built-in main-process rule" }
  ],
  "lastVerified": "2026-10-19"
}
