{
  "schemaVersion": 1,
  "id": "steam:578080",
  "status": "verified",
  "names": {
    "en": "PUBG: BATTLEGROUNDS",
    "zh-CN": "绝地求生"
  },
  "platform": "steam",
  "platformId": "578080",
  "executables": [
    { "name": "TslGame.exe" }
  ],
  "evidence": [
    { "kind": "platform_metadata", "source": "Steam AppID 578080" },
    { "kind": "manual_review", "source": "Game2PL built-in compatibility rule" }
  ],
  "lastVerified": "2026-10-19"
}
