{
  "schemaVersion": 1,
  "id": "steam:1196590",
  "status": "verified",
  "names": {
    "en": "Resident Evil Village"
  },
  "platform": "steam",
  "platformId": "1196590",
  "executables": [
    {
      "name": "re8.exe"
    }
  ],
  "evidence": [
    {
      "kind": "official_store",
      "source": "https://store.steampowered.com/app/1196590/Resident_Evil_Village/"
    },
    {
      "kind": "publisher",
      "source": "https://www.capcom-support.com/hc/en-us/articles/5598567332508-Resident-Evil-Village-General-Troubleshooting-Guide-Steam Capcom identifies re8.exe as the game executable in the Steam installation."
    }
  ],
  "lastVerified": "2026-10-28"
}
