{
  "schemaVersion": 1,
  "id": "steam:1716740",
  "status": "verified",
  "names": {
    "en": "Starfield"
  },
  "platform": "steam",
  "platformId": "1716740",
  "executables": [
    {
      "name": "Starfield.exe"
    }
  ],
  "evidence": [
    {
      "kind": "official_store",
      "source": "https://store.steampowered.com/app/1716740/Starfield/"
    },
    {
      "kind": "publisher",
      "source": "https://help.bethesda.net/app/answers/detail/a_id/62109/ Bethesda identifies Starfield.exe in the Steam game installation directory."
    }
  ],
  "lastVerified": "2026-10-28"
}
