{
  "schemaVersion": 1,
  "id": "wegame:2",
  "status": "verified",
  "names": {
    "en": "CrossFire",
    "zh-CN": "穿越火线"
  },
  "platform": "wegame",
  "platformId": "2",
  "executables": [
    { "name": "crossfire.exe", "relativePath": "x64/crossfire.exe" }
  ],
  "evidence": [
    { "kind": "platform_metadata", "source": "WeGame Rail game_id 2 and installed Rail manifest verified" },
    { "kind": "manual_review", "source": "Main game process is crossfire.exe; launcher and TenProtect components excluded" }
  ],
  "lastVerified": "2026-10-19"
}
