{
  "schemaVersion": 1,
  "id": "steam:377160",
  "status": "verified",
  "names": {
    "en": "Fallout 4"
  },
  "platform": "steam",
  "platformId": "377160",
  "executables": [
    {
      "name": "Fallout4.exe"
    }
  ],
  "evidence": [
    {
      "kind": "official_store",
      "source": "https://store.steampowered.com/app/377160/Fallout_4/"
    },
    {
      "kind": "publisher",
      "source": "https://help.bethesda.net/app/answers/detail/a_id/40902/ Bethesda names Fallout4.exe separately from Fallout4Launcher.exe."
    }
  ],
  "lastVerified": "2026-10-28"
}
